{
  "schema": "ctxlane.identity-lease/v1",
  "lease_id": "lease_01ARZ3NDEKTSV4RRFFQ69G5FB0",
  "status": "active",
  "tenant_id": "tenant-acme",
  "work_order_id": "wo_01ARZ3NDEKTSV4RRFFQ69G5FAV",
  "work_order_digest": "sha256:a36dbc1704725260b0896399529c16a86acabb6849bb1c9abeb251d7ffd16e6c",
  "run_id": "run_01ARZ3NDEKTSV4RRFFQ69G5FAV",
  "attempt_id": "attempt_01",
  "role": "implementer",
  "provider": "codex",
  "profile_uid": "profile_01ARZ3NDEKTSV4RRFFQ69G5FAV",
  "profile_ref": "codex:automation-production",
  "repository": "github:acme/payments",
  "workspace_id": "workspace_01ARZ3NDEKTSV4RRFFQ69G5FAV",
  "environment": "production",
  "caller_subject": "caller:local-controller",
  "host_identity": "host:runner-01",
  "worker_identity": "worker:controller-01",
  "principal_ref": "service-account:automation-worker",
  "workspace_ref": "chatgpt-workspace:ws_automation_prod",
  "auth_mode": "wif",
  "fencing_generation": 1,
  "issued_at": "2026-08-21T10:00:00Z",
  "expires_at": "2026-08-21T10:15:00Z",
  "maximum_expires_at": "2026-08-21T14:00:00Z",
  "execution_handle": "exec_01ARZ3NDEKTSV4RRFFQ69G5FB1",
  "isolation": "credential-isolated",
  "effective_policy_digest": "sha256:bb42590da6d8c5c0c0103b67572979c60d3c44a5a5a2cfa74f469e8cd7cf3d12",
  "refusal_code": null,
  "reason_code": null
}
