{
  "schema": "ctxlane.identity-lease/v1",
  "lease_id": "lease_01ARZ3NDEKTSV4RRFFQ69G5FB2",
  "status": "refused",
  "tenant_id": "tenant-acme",
  "work_order_id": "wo_01ARZ3NDEKTSV4RRFFQ69G5FAV",
  "work_order_digest": "sha256:a36dbc1704725260b0896399529c16a86acabb6849bb1c9abeb251d7ffd16e6c",
  "run_id": "run_01ARZ3NDEKTSV4RRFFQ69G5FAV",
  "attempt_id": "attempt_01",
  "role": "implementer",
  "provider": "codex",
  "profile_uid": "profile_01ARZ3NDEKTSV4RRFFQ69G5FAV",
  "profile_ref": "codex:automation-production",
  "repository": "github:acme/payments",
  "workspace_id": "workspace_01ARZ3NDEKTSV4RRFFQ69G5FAV",
  "environment": "production",
  "caller_subject": "caller:local-controller",
  "host_identity": "host:runner-01",
  "worker_identity": null,
  "principal_ref": null,
  "workspace_ref": null,
  "auth_mode": null,
  "fencing_generation": null,
  "issued_at": "2026-08-21T10:00:00Z",
  "expires_at": null,
  "maximum_expires_at": null,
  "execution_handle": null,
  "isolation": null,
  "effective_policy_digest": null,
  "refusal_code": "profile-not-ready",
  "reason_code": null
}
